{
  "Environment": {
    "Id": "Environments-682",
    "Name": "tdd",
    "Slug": "tdd",
    "Tags": []
  },
  "Project": {
    "Id": "Projects-1043",
    "Name": "biblefleet-dashboard",
    "Slug": "biblefleet-dashboard",
    "Tags": []
  },
  "Space": {
    "Id": "Spaces-396",
    "Name": "biblefleet",
    "Slug": "biblefleet"
  },
  "ProjectGroup": {
    "Id": "ProjectGroups-817",
    "Name": "biblefleet",
    "Slug": "biblefleet-1"
  },
  "Steps": [
    {
      "Id": "c4dc33de-728c-4430-8c88-b89617e09a2b",
      "Slug": "sign-off",
      "ActionType": "Octopus.Manual",
      "Enabled": true,
      "IsRequired": false,
      "IsConditional": true,
      "Source": {
        "Type": "",
        "SlugOrId": ""
      },
      "Packages": []
    },
    {
      "Id": "a499b48b-196d-4207-866d-8e48ac576439",
      "Slug": "update-deployable",
      "ActionType": "Octopus.AzurePowerShell",
      "Enabled": true,
      "IsRequired": false,
      "IsConditional": false,
      "Source": {
        "Type": "",
        "SlugOrId": ""
      },
      "Packages": [
        {
          "Id": "211e255e-b1d0-4463-982b-02c1c67d614a",
          "Name": "biblefleet-dashboard",
          "Version": "1.0.1",
          "Feed": {
            "Id": "Feeds-1891",
            "Name": "Octopus Server (built-in)",
            "Slug": "octopus-server-built-in",
            "Type": "BuiltIn",
            "Source": "Space"
          }
        }
      ]
    },
    {
      "Id": "4e7041b3-8a4b-4979-a314-5abfddb1a34e",
      "Slug": "verify-deployable",
      "ActionType": "Octopus.AzurePowerShell",
      "Enabled": true,
      "IsRequired": false,
      "IsConditional": false,
      "Source": {
        "Type": "",
        "SlugOrId": ""
      },
      "Packages": [
        {
          "Id": "7676951b-b79d-4a75-a33e-481a18e7b264",
          "Name": "biblefleet-dashboard",
          "Version": "1.0.1",
          "Feed": {
            "Id": "Feeds-1891",
            "Name": "Octopus Server (built-in)",
            "Slug": "octopus-server-built-in",
            "Type": "BuiltIn",
            "Source": "Space"
          }
        }
      ]
    },
    {
      "Id": "ae7305b2-bc8e-4d83-a0b4-45978bcbb7c2",
      "Slug": "run-acceptance-tests",
      "ActionType": "Octopus.AzurePowerShell",
      "Enabled": true,
      "IsRequired": false,
      "IsConditional": true,
      "Source": {
        "Type": "",
        "SlugOrId": ""
      },
      "Packages": [
        {
          "Id": "0a4c3373-65da-4186-bc7a-a096f1c0bbc2",
          "Name": "biblefleet-dashboard",
          "Version": "1.0.1",
          "Feed": {
            "Id": "Feeds-1891",
            "Name": "Octopus Server (built-in)",
            "Slug": "octopus-server-built-in",
            "Type": "BuiltIn",
            "Source": "Space"
          }
        }
      ]
    }
  ],
  "SkippedSteps": [],
  "Execution": [
    {
      "StartTrigger": "StartAfterPrevious",
      "Steps": [
        "c4dc33de-728c-4430-8c88-b89617e09a2b"
      ]
    },
    {
      "StartTrigger": "StartAfterPrevious",
      "Steps": [
        "a499b48b-196d-4207-866d-8e48ac576439"
      ]
    },
    {
      "StartTrigger": "StartAfterPrevious",
      "Steps": [
        "4e7041b3-8a4b-4979-a314-5abfddb1a34e"
      ]
    },
    {
      "StartTrigger": "StartAfterPrevious",
      "Steps": [
        "ae7305b2-bc8e-4d83-a0b4-45978bcbb7c2"
      ]
    }
  ],
  "RequiresApproval": false,
  "Actor": {
    "Id": "Users-870",
    "Username": "biblefleet-github",
    "Type": "ServiceAccount"
  },
  "CreatedAt": "2026-10-09T05:44:35.668Z",
  "Release": {
    "Id": "Releases-50226",
    "Name": "1.0.1",
    "Version": "1.0.1"
  }
}
