{
  "Environment": {
    "Id": "Environments-623",
    "Name": "prod",
    "Slug": "prod",
    "Tags": []
  },
  "Project": {
    "Id": "Projects-1035",
    "Name": "cmdemo1-dashboard",
    "Slug": "cmdemo1-dashboard",
    "Tags": []
  },
  "Space": {
    "Id": "Spaces-355",
    "Name": "cmdemo1 demo",
    "Slug": "cmdemo1-demo"
  },
  "ProjectGroup": {
    "Id": "ProjectGroups-775",
    "Name": "cmdemo1",
    "Slug": "cmdemo1"
  },
  "Steps": [
    {
      "Id": "46dfad26-1083-4515-9bd9-8e195390b7f9",
      "Slug": "sign-off",
      "ActionType": "Octopus.Manual",
      "Enabled": true,
      "IsRequired": false,
      "IsConditional": true,
      "Source": {
        "Type": "",
        "SlugOrId": ""
      },
      "Packages": []
    },
    {
      "Id": "2eedfa93-7515-4708-a2d9-7dbec13e3589",
      "Slug": "pin-version",
      "ActionType": "Octopus.Script",
      "Enabled": true,
      "IsRequired": false,
      "IsConditional": false,
      "Source": {
        "Type": "",
        "SlugOrId": ""
      },
      "Packages": []
    },
    {
      "Id": "c54ee54d-e035-4db3-b439-a399b07ccac9",
      "Slug": "update-deployable",
      "ActionType": "Octopus.AzurePowerShell",
      "Enabled": true,
      "IsRequired": false,
      "IsConditional": false,
      "Source": {
        "Type": "",
        "SlugOrId": ""
      },
      "Packages": [
        {
          "Id": "c81408f3-659a-452c-9feb-f461996b443a",
          "Name": "cmdemo1-dashboard",
          "Version": "1.0.3",
          "Feed": {
            "Id": "Feeds-1847",
            "Name": "Octopus Server (built-in)",
            "Slug": "octopus-server-built-in",
            "Type": "BuiltIn",
            "Source": "Space"
          }
        }
      ]
    },
    {
      "Id": "37ba9759-6611-4e01-a9e1-cea48904a102",
      "Slug": "verify-deployable",
      "ActionType": "Octopus.AzurePowerShell",
      "Enabled": true,
      "IsRequired": false,
      "IsConditional": false,
      "Source": {
        "Type": "",
        "SlugOrId": ""
      },
      "Packages": []
    },
    {
      "Id": "b1b44b0e-5e29-451c-a92f-6ef6641d6c85",
      "Slug": "revert-pin",
      "ActionType": "Octopus.Script",
      "Enabled": true,
      "IsRequired": false,
      "IsConditional": true,
      "Source": {
        "Type": "",
        "SlugOrId": ""
      },
      "Packages": []
    }
  ],
  "SkippedSteps": [],
  "Execution": [
    {
      "StartTrigger": "StartAfterPrevious",
      "Steps": [
        "46dfad26-1083-4515-9bd9-8e195390b7f9"
      ]
    },
    {
      "StartTrigger": "StartAfterPrevious",
      "Steps": [
        "2eedfa93-7515-4708-a2d9-7dbec13e3589"
      ]
    },
    {
      "StartTrigger": "StartAfterPrevious",
      "Steps": [
        "c54ee54d-e035-4db3-b439-a399b07ccac9"
      ]
    },
    {
      "StartTrigger": "StartAfterPrevious",
      "Steps": [
        "37ba9759-6611-4e01-a9e1-cea48904a102"
      ]
    },
    {
      "StartTrigger": "StartAfterPrevious",
      "Steps": [
        "b1b44b0e-5e29-451c-a92f-6ef6641d6c85"
      ]
    }
  ],
  "RequiresApproval": false,
  "Actor": {
    "Id": "Users-781",
    "Username": "ai-ops",
    "Type": "Agent"
  },
  "CreatedAt": "2026-10-08T10:57:34.132Z",
  "Release": {
    "Id": "Releases-50142",
    "Name": "1.0.3",
    "Version": "1.0.3"
  }
}
