{
  "Environment": {
    "Id": "Environments-663",
    "Name": "prod",
    "Slug": "prod",
    "Tags": []
  },
  "Project": {
    "Id": "Projects-1034",
    "Name": "jpcom-dashboard",
    "Slug": "jpcom-dashboard",
    "Tags": []
  },
  "Space": {
    "Id": "Spaces-375",
    "Name": "JeffreyPalermo - Sites",
    "Slug": "jeffreypalermo-sites"
  },
  "ProjectGroup": {
    "Id": "ProjectGroups-795",
    "Name": "jpcom",
    "Slug": "jpcom"
  },
  "Steps": [
    {
      "Id": "1b9c9401-5b99-4327-b332-7c8bec68ceaa",
      "Slug": "sign-off",
      "ActionType": "Octopus.Manual",
      "Enabled": true,
      "IsRequired": false,
      "IsConditional": true,
      "Source": {
        "Type": "",
        "SlugOrId": ""
      },
      "Packages": []
    },
    {
      "Id": "e48484a2-d7d6-4b34-8cd6-d750caebef4b",
      "Slug": "pin-version",
      "ActionType": "Octopus.Script",
      "Enabled": true,
      "IsRequired": false,
      "IsConditional": false,
      "Source": {
        "Type": "",
        "SlugOrId": ""
      },
      "Packages": []
    },
    {
      "Id": "c5a49b97-320c-4471-8a05-63ff632dd003",
      "Slug": "update-deployable",
      "ActionType": "Octopus.AzurePowerShell",
      "Enabled": true,
      "IsRequired": false,
      "IsConditional": false,
      "Source": {
        "Type": "",
        "SlugOrId": ""
      },
      "Packages": [
        {
          "Id": "460def63-710f-4c04-a776-374b18b7fa30",
          "Name": "jpcom-dashboard",
          "Version": "1.0.4",
          "Feed": {
            "Id": "Feeds-1867",
            "Name": "Octopus Server (built-in)",
            "Slug": "octopus-server-built-in",
            "Type": "BuiltIn",
            "Source": "Space"
          }
        }
      ]
    },
    {
      "Id": "54dab973-c04b-4957-8a8e-661c536829e1",
      "Slug": "verify-deployable",
      "ActionType": "Octopus.AzurePowerShell",
      "Enabled": true,
      "IsRequired": false,
      "IsConditional": false,
      "Source": {
        "Type": "",
        "SlugOrId": ""
      },
      "Packages": []
    },
    {
      "Id": "d151f5e2-6e03-4e25-b694-c41acaf64a88",
      "Slug": "revert-pin",
      "ActionType": "Octopus.Script",
      "Enabled": true,
      "IsRequired": false,
      "IsConditional": true,
      "Source": {
        "Type": "",
        "SlugOrId": ""
      },
      "Packages": []
    }
  ],
  "SkippedSteps": [],
  "Execution": [
    {
      "StartTrigger": "StartAfterPrevious",
      "Steps": [
        "1b9c9401-5b99-4327-b332-7c8bec68ceaa"
      ]
    },
    {
      "StartTrigger": "StartAfterPrevious",
      "Steps": [
        "e48484a2-d7d6-4b34-8cd6-d750caebef4b"
      ]
    },
    {
      "StartTrigger": "StartAfterPrevious",
      "Steps": [
        "c5a49b97-320c-4471-8a05-63ff632dd003"
      ]
    },
    {
      "StartTrigger": "StartAfterPrevious",
      "Steps": [
        "54dab973-c04b-4957-8a8e-661c536829e1"
      ]
    },
    {
      "StartTrigger": "StartAfterPrevious",
      "Steps": [
        "d151f5e2-6e03-4e25-b694-c41acaf64a88"
      ]
    }
  ],
  "RequiresApproval": false,
  "Actor": {
    "Id": "Users-781",
    "Username": "ai-ops",
    "Type": "Agent"
  },
  "CreatedAt": "2026-10-08T14:04:56.957Z",
  "Release": {
    "Id": "Releases-50146",
    "Name": "1.0.4",
    "Version": "1.0.4"
  }
}
