{
  "Environment": {
    "Id": "Environments-681",
    "Name": "tdd",
    "Slug": "tdd",
    "Tags": []
  },
  "Project": {
    "Id": "Projects-1042",
    "Name": "adameve-web",
    "Slug": "adameve-web",
    "Tags": []
  },
  "Space": {
    "Id": "Spaces-395",
    "Name": "Adam and woman in the garden of Eden",
    "Slug": "adam-and-woman-in-the-garden-of-eden"
  },
  "ProjectGroup": {
    "Id": "ProjectGroups-815",
    "Name": "adameve",
    "Slug": "adameve"
  },
  "Steps": [
    {
      "Id": "3d5b8ceb-79f7-4b67-8ce4-156d55269cbc",
      "Slug": "sign-off",
      "ActionType": "Octopus.Manual",
      "Enabled": true,
      "IsRequired": false,
      "IsConditional": true,
      "Source": {
        "Type": "",
        "SlugOrId": ""
      },
      "Packages": []
    },
    {
      "Id": "b8cbd116-0f1d-4fbd-b624-2a68f7b4f4a9",
      "Slug": "pin-version",
      "ActionType": "Octopus.Script",
      "Enabled": true,
      "IsRequired": false,
      "IsConditional": false,
      "Source": {
        "Type": "",
        "SlugOrId": ""
      },
      "Packages": []
    },
    {
      "Id": "ad6c30a3-a82b-4afd-951b-fa6e67ff7536",
      "Slug": "update-deployable",
      "ActionType": "Octopus.AzurePowerShell",
      "Enabled": true,
      "IsRequired": false,
      "IsConditional": false,
      "Source": {
        "Type": "",
        "SlugOrId": ""
      },
      "Packages": [
        {
          "Id": "f232e0d0-0c01-45b5-b995-ca9583c234eb",
          "Name": "adameve-web",
          "Version": "1.0.9",
          "Feed": {
            "Id": "Feeds-1887",
            "Name": "Octopus Server (built-in)",
            "Slug": "octopus-server-built-in",
            "Type": "BuiltIn",
            "Source": "Space"
          }
        }
      ]
    },
    {
      "Id": "a0b10141-f131-4440-bbca-da88f5af8b7b",
      "Slug": "verify-deployable",
      "ActionType": "Octopus.AzurePowerShell",
      "Enabled": true,
      "IsRequired": false,
      "IsConditional": false,
      "Source": {
        "Type": "",
        "SlugOrId": ""
      },
      "Packages": [
        {
          "Id": "c5ac1df7-b80d-456d-9412-1896a399cefe",
          "Name": "adameve-web",
          "Version": "1.0.9",
          "Feed": {
            "Id": "Feeds-1887",
            "Name": "Octopus Server (built-in)",
            "Slug": "octopus-server-built-in",
            "Type": "BuiltIn",
            "Source": "Space"
          }
        }
      ]
    },
    {
      "Id": "67601754-926f-4e60-8414-535253a18083",
      "Slug": "record-nodes",
      "ActionType": "Octopus.Script",
      "Enabled": true,
      "IsRequired": false,
      "IsConditional": false,
      "Source": {
        "Type": "",
        "SlugOrId": ""
      },
      "Packages": []
    },
    {
      "Id": "c5551b3b-a289-45de-b4a6-d9da2b9df8f6",
      "Slug": "revert-deployable",
      "ActionType": "Octopus.AzurePowerShell",
      "Enabled": true,
      "IsRequired": false,
      "IsConditional": true,
      "Source": {
        "Type": "",
        "SlugOrId": ""
      },
      "Packages": [
        {
          "Id": "05c2d6d3-1fb0-4fac-bc9c-5c264cd0500c",
          "Name": "adameve-web",
          "Version": "1.0.9",
          "Feed": {
            "Id": "Feeds-1887",
            "Name": "Octopus Server (built-in)",
            "Slug": "octopus-server-built-in",
            "Type": "BuiltIn",
            "Source": "Space"
          }
        }
      ]
    },
    {
      "Id": "d2205bf6-f20f-46f9-ab68-00aff522361b",
      "Slug": "verify-revert",
      "ActionType": "Octopus.AzurePowerShell",
      "Enabled": true,
      "IsRequired": false,
      "IsConditional": true,
      "Source": {
        "Type": "",
        "SlugOrId": ""
      },
      "Packages": [
        {
          "Id": "83962243-e454-46f8-af94-9e95e807b18c",
          "Name": "adameve-web",
          "Version": "1.0.9",
          "Feed": {
            "Id": "Feeds-1887",
            "Name": "Octopus Server (built-in)",
            "Slug": "octopus-server-built-in",
            "Type": "BuiltIn",
            "Source": "Space"
          }
        }
      ]
    },
    {
      "Id": "d2f635d8-97e4-457c-af6f-28f90c5b3df7",
      "Slug": "record-nodes-after-revert",
      "ActionType": "Octopus.Script",
      "Enabled": true,
      "IsRequired": false,
      "IsConditional": true,
      "Source": {
        "Type": "",
        "SlugOrId": ""
      },
      "Packages": []
    },
    {
      "Id": "d05a7a41-5268-453e-b939-a3839cea7045",
      "Slug": "revert-pin",
      "ActionType": "Octopus.Script",
      "Enabled": true,
      "IsRequired": false,
      "IsConditional": true,
      "Source": {
        "Type": "",
        "SlugOrId": ""
      },
      "Packages": []
    }
  ],
  "SkippedSteps": [],
  "Execution": [
    {
      "StartTrigger": "StartAfterPrevious",
      "Steps": [
        "3d5b8ceb-79f7-4b67-8ce4-156d55269cbc"
      ]
    },
    {
      "StartTrigger": "StartAfterPrevious",
      "Steps": [
        "b8cbd116-0f1d-4fbd-b624-2a68f7b4f4a9"
      ]
    },
    {
      "StartTrigger": "StartAfterPrevious",
      "Steps": [
        "ad6c30a3-a82b-4afd-951b-fa6e67ff7536"
      ]
    },
    {
      "StartTrigger": "StartAfterPrevious",
      "Steps": [
        "a0b10141-f131-4440-bbca-da88f5af8b7b"
      ]
    },
    {
      "StartTrigger": "StartAfterPrevious",
      "Steps": [
        "67601754-926f-4e60-8414-535253a18083"
      ]
    },
    {
      "StartTrigger": "StartAfterPrevious",
      "Steps": [
        "c5551b3b-a289-45de-b4a6-d9da2b9df8f6"
      ]
    },
    {
      "StartTrigger": "StartAfterPrevious",
      "Steps": [
        "d2205bf6-f20f-46f9-ab68-00aff522361b"
      ]
    },
    {
      "StartTrigger": "StartAfterPrevious",
      "Steps": [
        "d2f635d8-97e4-457c-af6f-28f90c5b3df7"
      ]
    },
    {
      "StartTrigger": "StartAfterPrevious",
      "Steps": [
        "d05a7a41-5268-453e-b939-a3839cea7045"
      ]
    }
  ],
  "RequiresApproval": false,
  "Actor": {
    "Id": "Users-866",
    "Username": "adameve-github",
    "Type": "ServiceAccount"
  },
  "CreatedAt": "2026-10-09T06:20:24.284Z",
  "Release": {
    "Id": "Releases-50229",
    "Name": "1.0.9",
    "Version": "1.0.9"
  }
}
