{
  "Environment": {
    "Id": "Environments-627",
    "Name": "prod",
    "Slug": "prod",
    "Tags": []
  },
  "Project": {
    "Id": "Projects-1021",
    "Name": "cmdemo3-dashboard",
    "Slug": "cmdemo3-dashboard",
    "Tags": []
  },
  "Space": {
    "Id": "Spaces-357",
    "Name": "cmdemo3 demo",
    "Slug": "cmdemo3-demo"
  },
  "ProjectGroup": {
    "Id": "ProjectGroups-779",
    "Name": "cmdemo3",
    "Slug": "cmdemo3"
  },
  "Steps": [
    {
      "Id": "718ef103-8011-4ed7-a4d2-034ae9baf82d",
      "Slug": "sign-off",
      "ActionType": "Octopus.Manual",
      "Enabled": true,
      "IsRequired": false,
      "IsConditional": true,
      "Source": {
        "Type": "",
        "SlugOrId": ""
      },
      "Packages": []
    },
    {
      "Id": "b9a9c0f2-ac6a-4aae-ae3b-8a1334ef0d93",
      "Slug": "update-deployable",
      "ActionType": "Octopus.ArgoCDUpdateImageTags",
      "Enabled": true,
      "IsRequired": false,
      "IsConditional": false,
      "Source": {
        "Type": "",
        "SlugOrId": ""
      },
      "Packages": [
        {
          "Id": "0759ea56-2cea-4aab-acf8-2cd96bf6bd2f",
          "Name": "cmdemo3/dashboard",
          "Version": "1.0.13",
          "Feed": {
            "Id": "Feeds-1859",
            "Name": "acr-cmdemo3",
            "Slug": "acr-cmdemo3",
            "Type": "AzureContainerRegistry",
            "Source": "Space",
            "Uri": "https://acrcmdemo3q3zmsi.azurecr.io"
          }
        }
      ]
    },
    {
      "Id": "d9c8b73f-f62e-4d77-be0f-9725c20cff7b",
      "Slug": "measure-availability",
      "ActionType": "Octopus.Script",
      "Enabled": true,
      "IsRequired": false,
      "IsConditional": false,
      "Source": {
        "Type": "",
        "SlugOrId": ""
      },
      "Packages": []
    },
    {
      "Id": "452f8789-5f8b-4b82-bfaf-0b1e6983116b",
      "Slug": "write-dashboard-content",
      "ActionType": "Octopus.Script",
      "Enabled": true,
      "IsRequired": false,
      "IsConditional": false,
      "Source": {
        "Type": "",
        "SlugOrId": ""
      },
      "Packages": []
    },
    {
      "Id": "8fcbf6f1-4595-4f24-a84c-96dd1a9663a9",
      "Slug": "verify-deployable",
      "ActionType": "Octopus.Script",
      "Enabled": true,
      "IsRequired": false,
      "IsConditional": false,
      "Source": {
        "Type": "",
        "SlugOrId": ""
      },
      "Packages": []
    },
    {
      "Id": "e212332d-b95d-4831-8bc4-489706ccca1d",
      "Slug": "revert-pin",
      "ActionType": "Octopus.Script",
      "Enabled": true,
      "IsRequired": false,
      "IsConditional": true,
      "Source": {
        "Type": "",
        "SlugOrId": ""
      },
      "Packages": []
    }
  ],
  "SkippedSteps": [],
  "Execution": [
    {
      "StartTrigger": "StartAfterPrevious",
      "Steps": [
        "718ef103-8011-4ed7-a4d2-034ae9baf82d"
      ]
    },
    {
      "StartTrigger": "StartAfterPrevious",
      "Steps": [
        "b9a9c0f2-ac6a-4aae-ae3b-8a1334ef0d93"
      ]
    },
    {
      "StartTrigger": "StartWithPrevious",
      "Steps": [
        "d9c8b73f-f62e-4d77-be0f-9725c20cff7b"
      ]
    },
    {
      "StartTrigger": "StartAfterPrevious",
      "Steps": [
        "452f8789-5f8b-4b82-bfaf-0b1e6983116b"
      ]
    },
    {
      "StartTrigger": "StartAfterPrevious",
      "Steps": [
        "8fcbf6f1-4595-4f24-a84c-96dd1a9663a9"
      ]
    },
    {
      "StartTrigger": "StartAfterPrevious",
      "Steps": [
        "e212332d-b95d-4831-8bc4-489706ccca1d"
      ]
    }
  ],
  "RequiresApproval": false,
  "Actor": {
    "Id": "Users-781",
    "Username": "ai-ops",
    "Type": "Agent"
  },
  "CreatedAt": "2026-10-08T02:57:40.259Z",
  "Release": {
    "Id": "Releases-50102",
    "Name": "1.0.13",
    "Version": "1.0.13"
  }
}
