{
  "Environment": {
    "Id": "Environments-681",
    "Name": "tdd",
    "Slug": "tdd",
    "Tags": []
  },
  "Project": {
    "Id": "Projects-1041",
    "Name": "adameve-system",
    "Slug": "adameve-system",
    "Tags": []
  },
  "Space": {
    "Id": "Spaces-395",
    "Name": "Adam and woman in the garden of Eden",
    "Slug": "adam-and-woman-in-the-garden-of-eden"
  },
  "ProjectGroup": {
    "Id": "ProjectGroups-815",
    "Name": "adameve",
    "Slug": "adameve"
  },
  "Steps": [
    {
      "Id": "d290dd69-cfc2-4092-b799-f5de8baba2a1",
      "Slug": "sign-off",
      "ActionType": "Octopus.Manual",
      "Enabled": true,
      "IsRequired": false,
      "IsConditional": true,
      "Source": {
        "Type": "",
        "SlugOrId": ""
      },
      "Packages": []
    },
    {
      "Id": "78158a04-4949-413f-a32a-2ccf063be0e1",
      "Slug": "apply-environment",
      "ActionType": "Octopus.AzurePowerShell",
      "Enabled": true,
      "IsRequired": false,
      "IsConditional": false,
      "Source": {
        "Type": "",
        "SlugOrId": ""
      },
      "Packages": [
        {
          "Id": "148adb09-bd7d-466e-bb30-67d0bdad3d12",
          "Name": "adameve-system",
          "Version": "1.0.3",
          "Feed": {
            "Id": "Feeds-1887",
            "Name": "Octopus Server (built-in)",
            "Slug": "octopus-server-built-in",
            "Type": "BuiltIn",
            "Source": "Space"
          }
        }
      ]
    },
    {
      "Id": "136b0acb-5e84-4977-811b-7bd44fcbacf2",
      "Slug": "verify-environment",
      "ActionType": "Octopus.AzurePowerShell",
      "Enabled": true,
      "IsRequired": false,
      "IsConditional": false,
      "Source": {
        "Type": "",
        "SlugOrId": ""
      },
      "Packages": []
    }
  ],
  "SkippedSteps": [],
  "Execution": [
    {
      "StartTrigger": "StartAfterPrevious",
      "Steps": [
        "d290dd69-cfc2-4092-b799-f5de8baba2a1"
      ]
    },
    {
      "StartTrigger": "StartAfterPrevious",
      "Steps": [
        "78158a04-4949-413f-a32a-2ccf063be0e1"
      ]
    },
    {
      "StartTrigger": "StartAfterPrevious",
      "Steps": [
        "136b0acb-5e84-4977-811b-7bd44fcbacf2"
      ]
    }
  ],
  "RequiresApproval": false,
  "Actor": {
    "Id": "Users-866",
    "Username": "adameve-github",
    "Type": "ServiceAccount"
  },
  "CreatedAt": "2026-10-09T05:59:58.819Z",
  "Release": {
    "Id": "Releases-50227",
    "Name": "1.0.3",
    "Version": "1.0.3"
  }
}
