{
  "Environment": {
    "Id": "Environments-663",
    "Name": "prod",
    "Slug": "prod",
    "Tags": []
  },
  "Project": {
    "Id": "Projects-1022",
    "Name": "jpcom-system",
    "Slug": "jpcom-system",
    "Tags": []
  },
  "Space": {
    "Id": "Spaces-375",
    "Name": "JeffreyPalermo - Sites",
    "Slug": "jeffreypalermo-sites"
  },
  "ProjectGroup": {
    "Id": "ProjectGroups-795",
    "Name": "jpcom",
    "Slug": "jpcom"
  },
  "Steps": [
    {
      "Id": "b28074d7-3c6b-49c6-ab2b-8193d798d43d",
      "Slug": "sign-off",
      "ActionType": "Octopus.Manual",
      "Enabled": true,
      "IsRequired": false,
      "IsConditional": true,
      "Source": {
        "Type": "",
        "SlugOrId": ""
      },
      "Packages": []
    },
    {
      "Id": "43e52da8-92b4-4ff0-b408-c25dc51b25be",
      "Slug": "apply-environment",
      "ActionType": "Octopus.AzurePowerShell",
      "Enabled": true,
      "IsRequired": false,
      "IsConditional": false,
      "Source": {
        "Type": "",
        "SlugOrId": ""
      },
      "Packages": [
        {
          "Id": "8327f3fd-0040-4b45-848a-b2ddcc60bc62",
          "Name": "jpcom-system",
          "Version": "1.0.21",
          "Feed": {
            "Id": "Feeds-1867",
            "Name": "Octopus Server (built-in)",
            "Slug": "octopus-server-built-in",
            "Type": "BuiltIn",
            "Source": "Space"
          }
        }
      ]
    },
    {
      "Id": "1dc3eeb2-c62f-4de1-8232-131b67d26714",
      "Slug": "verify-environment",
      "ActionType": "Octopus.AzurePowerShell",
      "Enabled": true,
      "IsRequired": false,
      "IsConditional": false,
      "Source": {
        "Type": "",
        "SlugOrId": ""
      },
      "Packages": []
    }
  ],
  "SkippedSteps": [],
  "Execution": [
    {
      "StartTrigger": "StartAfterPrevious",
      "Steps": [
        "b28074d7-3c6b-49c6-ab2b-8193d798d43d"
      ]
    },
    {
      "StartTrigger": "StartAfterPrevious",
      "Steps": [
        "43e52da8-92b4-4ff0-b408-c25dc51b25be"
      ]
    },
    {
      "StartTrigger": "StartAfterPrevious",
      "Steps": [
        "1dc3eeb2-c62f-4de1-8232-131b67d26714"
      ]
    }
  ],
  "RequiresApproval": false,
  "Actor": {
    "Id": "Users-781",
    "Username": "ai-ops",
    "Type": "Agent"
  },
  "CreatedAt": "2026-10-08T16:54:24.491Z",
  "Release": {
    "Id": "Releases-50160",
    "Name": "1.0.21",
    "Version": "1.0.21"
  }
}
