{
  "Environment": {
    "Id": "Environments-627",
    "Name": "prod",
    "Slug": "prod",
    "Tags": []
  },
  "Project": {
    "Id": "Projects-1024",
    "Name": "cmdemo3-status",
    "Slug": "cmdemo3-status",
    "Tags": []
  },
  "Space": {
    "Id": "Spaces-357",
    "Name": "cmdemo3 demo",
    "Slug": "cmdemo3-demo"
  },
  "ProjectGroup": {
    "Id": "ProjectGroups-779",
    "Name": "cmdemo3",
    "Slug": "cmdemo3"
  },
  "Steps": [
    {
      "Id": "695b9440-44ae-45d6-b2ab-c153d15a90e2",
      "Slug": "sign-off",
      "ActionType": "Octopus.Manual",
      "Enabled": true,
      "IsRequired": false,
      "IsConditional": true,
      "Source": {
        "Type": "",
        "SlugOrId": ""
      },
      "Packages": []
    },
    {
      "Id": "1f3b547b-1f14-4962-a6d1-a5af10185c44",
      "Slug": "update-deployable",
      "ActionType": "Octopus.AzurePowerShell",
      "Enabled": true,
      "IsRequired": false,
      "IsConditional": false,
      "Source": {
        "Type": "",
        "SlugOrId": ""
      },
      "Packages": [
        {
          "Id": "18644ad9-ea73-42b4-8e4d-a33b93931d4d",
          "Name": "cmdemo3-status",
          "Version": "1.0.11",
          "Feed": {
            "Id": "Feeds-1855",
            "Name": "Octopus Server (built-in)",
            "Slug": "octopus-server-built-in",
            "Type": "BuiltIn",
            "Source": "Space"
          }
        }
      ]
    },
    {
      "Id": "9d588bff-4f2d-4678-b4e4-d7de9c84cdf2",
      "Slug": "verify-deployable",
      "ActionType": "Octopus.Script",
      "Enabled": true,
      "IsRequired": false,
      "IsConditional": false,
      "Source": {
        "Type": "",
        "SlugOrId": ""
      },
      "Packages": []
    }
  ],
  "SkippedSteps": [],
  "Execution": [
    {
      "StartTrigger": "StartAfterPrevious",
      "Steps": [
        "695b9440-44ae-45d6-b2ab-c153d15a90e2"
      ]
    },
    {
      "StartTrigger": "StartAfterPrevious",
      "Steps": [
        "1f3b547b-1f14-4962-a6d1-a5af10185c44"
      ]
    },
    {
      "StartTrigger": "StartAfterPrevious",
      "Steps": [
        "9d588bff-4f2d-4678-b4e4-d7de9c84cdf2"
      ]
    }
  ],
  "RequiresApproval": false,
  "Actor": {
    "Id": "Users-781",
    "Username": "ai-ops",
    "Type": "Agent"
  },
  "CreatedAt": "2026-10-08T17:51:17.358Z",
  "Release": {
    "Id": "Releases-50167",
    "Name": "1.0.11",
    "Version": "1.0.11"
  }
}
