{
  "Environment": {
    "Id": "Environments-669",
    "Name": "prod",
    "Slug": "prod",
    "Tags": []
  },
  "Project": {
    "Id": "Projects-1033",
    "Name": "cmfleet-dashboard",
    "Slug": "cmfleet-dashboard",
    "Tags": []
  },
  "Space": {
    "Id": "Spaces-378",
    "Name": "cmfleet",
    "Slug": "cmfleet"
  },
  "ProjectGroup": {
    "Id": "ProjectGroups-799",
    "Name": "cmfleet",
    "Slug": "cmfleet-1"
  },
  "Steps": [
    {
      "Id": "f17cd148-c707-427f-93fd-8980f9e11709",
      "Slug": "sign-off",
      "ActionType": "Octopus.Manual",
      "Enabled": true,
      "IsRequired": false,
      "IsConditional": true,
      "Source": {
        "Type": "",
        "SlugOrId": ""
      },
      "Packages": []
    },
    {
      "Id": "8ce9b3b4-2413-4b8c-89e5-23c67f9f9de9",
      "Slug": "update-deployable",
      "ActionType": "Octopus.AzurePowerShell",
      "Enabled": true,
      "IsRequired": false,
      "IsConditional": false,
      "Source": {
        "Type": "",
        "SlugOrId": ""
      },
      "Packages": [
        {
          "Id": "1ca6a900-9c71-4075-8817-8fe71d624354",
          "Name": "cmfleet-dashboard",
          "Version": "1.0.27",
          "Feed": {
            "Id": "Feeds-1875",
            "Name": "Octopus Server (built-in)",
            "Slug": "octopus-server-built-in",
            "Type": "BuiltIn",
            "Source": "Space"
          }
        }
      ]
    },
    {
      "Id": "838469b5-3f20-4a9a-a298-9b15d1ef9033",
      "Slug": "verify-deployable",
      "ActionType": "Octopus.AzurePowerShell",
      "Enabled": true,
      "IsRequired": false,
      "IsConditional": false,
      "Source": {
        "Type": "",
        "SlugOrId": ""
      },
      "Packages": [
        {
          "Id": "1312fe9e-258e-434b-8cc7-e3e57924fd48",
          "Name": "cmfleet-dashboard",
          "Version": "1.0.27",
          "Feed": {
            "Id": "Feeds-1875",
            "Name": "Octopus Server (built-in)",
            "Slug": "octopus-server-built-in",
            "Type": "BuiltIn",
            "Source": "Space"
          }
        }
      ]
    },
    {
      "Id": "4cc509e5-91e8-4519-9cb4-4844ec4ce895",
      "Slug": "run-acceptance-tests",
      "ActionType": "Octopus.AzurePowerShell",
      "Enabled": true,
      "IsRequired": false,
      "IsConditional": true,
      "Source": {
        "Type": "",
        "SlugOrId": ""
      },
      "Packages": [
        {
          "Id": "28f87b94-c93a-47c2-97ec-120899b9f702",
          "Name": "cmfleet-dashboard",
          "Version": "1.0.27",
          "Feed": {
            "Id": "Feeds-1875",
            "Name": "Octopus Server (built-in)",
            "Slug": "octopus-server-built-in",
            "Type": "BuiltIn",
            "Source": "Space"
          }
        }
      ]
    }
  ],
  "SkippedSteps": [],
  "Execution": [
    {
      "StartTrigger": "StartAfterPrevious",
      "Steps": [
        "f17cd148-c707-427f-93fd-8980f9e11709"
      ]
    },
    {
      "StartTrigger": "StartAfterPrevious",
      "Steps": [
        "8ce9b3b4-2413-4b8c-89e5-23c67f9f9de9"
      ]
    },
    {
      "StartTrigger": "StartAfterPrevious",
      "Steps": [
        "838469b5-3f20-4a9a-a298-9b15d1ef9033"
      ]
    },
    {
      "StartTrigger": "StartAfterPrevious",
      "Steps": [
        "4cc509e5-91e8-4519-9cb4-4844ec4ce895"
      ]
    }
  ],
  "RequiresApproval": false,
  "Actor": {
    "Id": "Users-781",
    "Username": "ai-ops",
    "Type": "Agent"
  },
  "CreatedAt": "2026-10-08T17:24:55.038Z",
  "Release": {
    "Id": "Releases-50164",
    "Name": "1.0.27",
    "Version": "1.0.27"
  }
}
